{
  "schemaVersion": "1.0.0",
  "kind": "ComparisonResult",
  "dataClass": "synthetic_fixture",
  "comparisonId": "dddddddd-dddd-4ddd-8ddd-dddddddddddd",
  "intent": "resource_candidate",
  "baseline": {
    "runId": "88888888-8888-4888-8888-888888888888",
    "manifestSha256": "8888888888888888888888888888888888888888888888888888888888888888"
  },
  "candidate": {
    "runId": "99999999-9999-4999-8999-999999999999",
    "manifestSha256": "9999999999999999999999999999999999999999999999999999999999999999"
  },
  "comparability": "comparable",
  "reasonCodes": [],
  "declaredResourceChanges": [
    "cpuRequest",
    "memoryRequest",
    "memoryLimit"
  ],
  "checkedConditions": {
    "logicalService": "match",
    "scenario": "match",
    "loadShape": "match",
    "resources": "differ",
    "replicas": "match",
    "runtimeSettings": "match",
    "runtimeVersion": "match",
    "profile": "match",
    "policy": "match",
    "nodeClass": "match",
    "imageDigest": "match",
    "sourceRevision": "match",
    "deploymentUid": "differ",
    "deploymentGeneration": "differ",
    "authFixture": "match",
    "dataFixture": "match",
    "latencySemantics": "match",
    "environmentRole": "match"
  },
  "deltas": {
    "cpuPeakMilli": -10,
    "memoryHighWaterBytes": 5242880,
    "p95LatencyNs": 2000000,
    "httpErrorRate": 0.0,
    "usefulThroughputRps": 0.2
  },
  "budget": {
    "outcome": "not_evaluated",
    "noisePolicyVersion": null
  },
  "baselineSlo": "passed",
  "candidateSlo": "passed",
  "ciVerdict": "pass"
}
