{
  "schemaVersion": "1.0.0",
  "kind": "ComparisonResult",
  "dataClass": "synthetic_fixture",
  "comparisonId": "eeeeeeee-eeee-4eee-8eee-eeeeeeeeeeee",
  "intent": "code_regression",
  "baseline": {
    "runId": "11111111-1111-4111-8111-111111111111",
    "manifestSha256": "1111111111111111111111111111111111111111111111111111111111111111"
  },
  "candidate": {
    "runId": "16161616-1616-4161-8161-161616161616",
    "manifestSha256": "ffffffffffffffffffffffffffffffffffffffffffffffffffffffffffffffff"
  },
  "comparability": "not_comparable",
  "reasonCodes": [
    "not_comparable",
    "runtime_version_differs"
  ],
  "checkedConditions": {
    "logicalService": "match",
    "scenario": "match",
    "loadShape": "match",
    "resources": "match",
    "replicas": "match",
    "runtimeSettings": "match",
    "runtimeVersion": "differ",
    "profile": "match",
    "policy": "match",
    "nodeClass": "match",
    "imageDigest": "match",
    "sourceRevision": "match",
    "deploymentUid": "match",
    "deploymentGeneration": "match",
    "authFixture": "match",
    "dataFixture": "match",
    "latencySemantics": "match",
    "environmentRole": "match"
  },
  "deltas": null,
  "budget": {
    "outcome": "not_evaluated",
    "noisePolicyVersion": null
  },
  "baselineSlo": "passed",
  "candidateSlo": "not_evaluated",
  "ciVerdict": "not_comparable"
}
