{
  "schemaVersion": "1.0.0",
  "kind": "ComparisonResult",
  "dataClass": "synthetic_fixture",
  "comparisonId": "cccccccc-cccc-4ccc-8ccc-cccccccccccc",
  "intent": "code_regression",
  "baseline": {
    "runId": "11111111-1111-4111-8111-111111111111",
    "manifestSha256": "1111111111111111111111111111111111111111111111111111111111111111"
  },
  "candidate": {
    "runId": "77777777-7777-4777-8777-777777777777",
    "manifestSha256": "7777777777777777777777777777777777777777777777777777777777777777"
  },
  "comparability": "comparable",
  "reasonCodes": [],
  "checkedConditions": {
    "logicalService": "match",
    "scenario": "match",
    "loadShape": "match",
    "resources": "match",
    "replicas": "match",
    "runtimeSettings": "match",
    "runtimeVersion": "match",
    "profile": "match",
    "policy": "match",
    "nodeClass": "match",
    "imageDigest": "differ",
    "sourceRevision": "differ",
    "deploymentUid": "differ",
    "deploymentGeneration": "differ",
    "authFixture": "match",
    "dataFixture": "match",
    "latencySemantics": "match",
    "environmentRole": "match"
  },
  "deltas": {
    "cpuPeakMilli": 20,
    "memoryHighWaterBytes": 1048576,
    "p95LatencyNs": 5000000,
    "httpErrorRate": 0.0,
    "usefulThroughputRps": -0.4
  },
  "budget": {
    "outcome": "not_evaluated",
    "noisePolicyVersion": null
  },
  "baselineSlo": "passed",
  "candidateSlo": "passed",
  "ciVerdict": "inconclusive"
}
